,Date,text,ID,Username
678,2020-05-03 06:01:03,"The governor of Kentucky apologized for saying someone named Tupac Shakur, who had applied for unemployment in the… https://t.co/vyw32D1VgH",1256826081992159232,CNN
679,2020-05-03 05:31:03,Celia Yap-Banago dedicated much of her life to her patients. But she died of coronavirus shortly before her 40th an… https://t.co/1abxv2yNWa,1256818531754270722,CNN
680,2020-05-03 05:01:03,"Future pandemics are likely to be more frequent, deadly, and will spread more rapidly, unless we stop the widesprea… https://t.co/7fEubxLacr",1256810984154464256,CNN
681,2020-05-03 04:31:06,The US Department of Defense has confirmed that three UFO videos made public over the past several years do indeed… https://t.co/INKS7AWokP,1256803444565909504,CNN
682,2020-05-03 04:01:05,"With much of the world's human population stuck at home during the coronavirus pandemic, one Japanese aquarium is e… https://t.co/EMsmrY7Vnp",1256795892750921735,CNN
683,2020-05-03 03:27:03,"Berkshire Hathaway, the massive conglomerate run by billionaire Warren Buffett, posted a nearly $50 billion net los… https://t.co/WUTnPZVsFZ",1256787326493233163,CNN
684,2020-05-03 03:00:02,"Meet gargantuan hail. It's hail that's 6 inches across and larger, according to researchers who proposed the name https://t.co/fBH47m1Cva",1256780530231713792,CNN
685,2020-05-03 02:29:05,"Actor Sam Lloyd, who appeared on several television shows and portrayed lawyer Ted Buckland on the comedy, ""Scrubs,… https://t.co/gkmJYbegoQ",1256772741522432008,CNN
686,2020-05-03 02:00:15,"Robert O'Brien, President Trump's fourth national security adviser, has been conspicuously out of sight in the admi… https://t.co/wbYECKkVqY",1256765481882660865,CNN
687,2020-05-03 01:45:02,Climate activist Greta Thunberg is donating prize money she won to help fight the coronavirus pandemic and protect… https://t.co/q3Xy50uqa9,1256761655402397699,CNN
688,2020-05-03 01:30:08,Owners of more than 120 of Georgia's most popular restaurants announced this week they won't be reopening their doo… https://t.co/WkAufkQuF9,1256757902733385728,CNN
689,2020-05-03 01:15:03,Another wave of coronavirus will likely hit the US in the fall. Here's why and what we can do to stop it: https://t.co/mB5HdgV36q,1256754108536586240,CNN
690,2020-05-03 01:00:14,. @JakeTapper investigates what really happened in the U.S. fight against Covid-19. Discover what he learned. Watch… https://t.co/l9Cf6K4HJh,1256750381448802304,CNN
691,2020-05-03 00:45:02,"In the darkest moments, sometimes a plan of action and a little luck are the only things people have https://t.co/AnTuzajd3w",1256746555727642624,CNN
692,2020-05-03 00:29:04,"If there's an unofficial snack of the coronavirus pandemic, it's a sweet, soft loaf of home-baked banana bread https://t.co/ygbk4PyL3C",1256742537945059330,CNN
693,2020-05-03 00:15:02,"In ""Never Have I Ever,"" the show's real magic is how much it twists stereotypes within even that experience. Here a… https://t.co/OkJjPE6VTF",1256739005758091264,CNN
694,2020-05-03 00:00:10,Warren Buffett said he remains convinced that nothing can stop the United States and that America will recover from… https://t.co/kllqdyHpBU,1256735262526373889,CNN
695,2020-05-02 23:45:06,"President Trump appeared to confirm Saturday that North Korean dictator Kim Jong Un is ""alive and well."" https://t.co/9DRr9XAhjR",1256731470988742657,CNN
696,2020-05-02 23:30:09,"President Trump appeared to confirm Saturday that North Korean dictator Kim Jong Un is ""alive and well."" https://t.co/AL6yEqIQQM",1256727707917922306,CNN
697,2020-05-02 23:15:08,"Lea Michele is indeed pregnant. The former ""Glee"" star confirmed rumors Saturday with an Instagram post https://t.co/IVdyXPdY48",1256723928539697163,CNN
698,2020-05-02 23:00:16,Blue Bell Creameries agreed to plead guilty to two misdemeanors and pay $19.3 million in fines for shipping contami… https://t.co/vaimOYHbIh,1256720189028208641,CNN
699,2020-05-02 22:45:06,"In the throes of a midlife crisis, journalist Angus MacKinnon bought a hotel on a Scottish island. Customer complai… https://t.co/kZw0uTXNFp",1256716372387737600,CNN
700,2020-05-02 22:31:08,"Hafþór Björnsson, best known for playing the Mountain in the popular HBO series ""Game of Thrones,"" just broke a maj… https://t.co/C1LiNOHGmj",1256712857560940544,CNN
701,2020-05-02 22:15:03,"Victoria Beckham shared a loving tribute on Instagram to her husband David Beckham, who turned 45 years old on Satu… https://t.co/Rck1cFntQB",1256708809952759809,CNN
702,2020-05-02 22:00:07,"Ariana Grande and Justin Bieber are releasing ""Stuck With U"" next week, and they want fans to be a part of it. If t… https://t.co/ojhdNnQxAz",1256705051218841603,CNN
703,2020-05-02 21:44:05,The nation's capital is under a stay-at-home order to slow down the spread of the virus but that didn't stop crowds… https://t.co/YHlLK7UxDt,1256701016340398081,CNN
704,2020-05-02 21:33:05,"On Twitter, former Vice President Joe Biden pledged to cut funding to the US Soccer Federation for World Cup fundin… https://t.co/KtPvciWacK",1256698248472997888,CNN
705,2020-05-02 21:22:04,"At least 46 people have died in a riot at the Los Llanos Penitentiary in the Venezuelan state of Portuguesa, accord… https://t.co/DzOIHppJI4",1256695477325701120,CNN
706,2020-05-02 21:11:02,"In ""Never Have I Ever,"" the show's real magic is how much it twists stereotypes within even that experience. Here a… https://t.co/igGLgS4yCD",1256692698406367234,CNN
707,2020-05-02 21:00:09,Several Trump Organization golf properties previously closed to comply with various business restrictions related t… https://t.co/eQdY3iPYIj,1256689959043506177,CNN
708,2020-05-02 20:52:05,White House economic adviser Kevin Hassett said that another round of coronavirus relief legislation might not be n… https://t.co/wS9LzMmwa6,1256687930384539649,CNN
709,2020-05-02 20:44:06,"A sixth woman who lived at Our Lady of the Angels Convent in Greenfield, Wisconsin -- a facility that cares for ret… https://t.co/0Y5QB82iOt",1256685923040976896,CNN
710,2020-05-02 20:33:05,"If there's an unofficial snack of the coronavirus pandemic, it's a sweet, soft loaf of home-baked banana bread https://t.co/rktajsLGTU",1256683147644764162,CNN
711,2020-05-02 20:22:06,"Oprah Winfrey invited fans into her home (virtually) Friday night for a spiritual discussion.
https://t.co/TmM8Z8hxWt",1256680384093401091,CNN
712,2020-05-02 20:11:04,"In the darkest moments, sometimes a plan of action and a little luck are the only things people have https://t.co/gzdvI0fOby",1256677607522930690,CNN
713,2020-05-02 20:00:22,"The first wave of emergency medical technicians who contracted Covid-19 and survived are now returning to the job,… https://t.co/43yJ6pzOIe",1256674914075115521,CNN
714,2020-05-02 19:44:05,"The Eta Aquariid meteor shower is expected to peak on Tuesday, but a nearly full moon could outshine the show. They… https://t.co/jhLgcg49de",1256670817636814849,CNN
715,2020-05-02 19:33:02,"The preliminary count of 351 tornadoes last month is the second most for any April on record, according to the Nati… https://t.co/kWj15gsTNp",1256668039271067651,CNN
716,2020-05-02 19:22:06,"Governors began easing restrictions in some states across the country. That might mean going to a movie in Georgia,… https://t.co/t4Ze2abDIs",1256665287694434304,CNN
717,2020-05-02 19:11:04,Another wave of coronavirus will likely hit the US in the fall. Here's why and what we can do to stop it. https://t.co/zOecbQ4ZqV,1256662508716331008,CNN
718,2020-05-02 19:00:13,"As some big cities were already seeing their populations dip, experts say the coronavirus pandemic could change who… https://t.co/aJXdH5PjQ4",1256659777293299712,CNN
719,2020-05-02 18:53:00,"As the coronavirus pandemic causes some New Yorkers to flee to the suburbs, experts say the virus could change who… https://t.co/c0ph5F5WRd",1256657961419550720,CNN
720,2020-05-02 18:44:04,Owners of more than 120 of Georgia's most popular restaurants announced this week they won't be reopening their doo… https://t.co/1iN2dubJql,1256655713939664896,CNN
721,2020-05-02 18:34:00,American Medical Association President Dr. Patrice Harris on doctors' mental health: “The number one priority of ph… https://t.co/Tp6RmtGMJk,1256653179929927681,CNN
722,2020-05-02 18:33:06,"Instead of the Kentucky Derby, this year's eight elite turtles will square off instead, as the annual horse race ha… https://t.co/ffmbu52FBL",1256652952758075398,CNN
723,2020-05-02 18:22:02,Climate activist Greta Thunberg is donating prize money she won to help fight the coronavirus pandemic and protect… https://t.co/PwUjV8pv1C,1256650167719264257,CNN
724,2020-05-02 18:12:03,Nightly confrontations between protesters and the army have rocked Lebanon's northern city of Tripoli after the cor… https://t.co/jjbEokxADn,1256647655217913857,CNN
725,2020-05-02 18:11:00,The ACLU and abortion providers sued Arkansas over an order requiring a negative Covid-19 test before elective medi… https://t.co/2c2G2qDPs2,1256647391546990594,CNN
726,2020-05-02 18:00:15,Here's the latest on Covid-19: It was a big week for remdesivir  https://t.co/np565uoBhY,1256644686132973568,CNN
727,2020-05-02 17:53:03,"With the 146th Kentucky Derby being postponed until September 5, horse racing fans are being treated to a virtual h… https://t.co/g0HEAVnrzm",1256642877419139077,CNN
728,2020-05-02 17:44:02,"A Houston Police Department helicopter crashed, killing one pilot and leaving the other in critical condition, auth… https://t.co/iy0QIetuxB",1256640607168102402,CNN
729,2020-05-02 17:33:03,"Andy Murray is backing a merger between the men's and women's tennis tours, a topic that rose to the forefront afte… https://t.co/ZBiDWhGKIU",1256637842123567105,CNN
730,2020-05-02 17:22:01,"Robert O'Brien, President Trump's fourth national security adviser, has been conspicuously out of sight in the admi… https://t.co/ycFcbVu3D2",1256635066781925382,CNN
731,2020-05-02 17:11:03,"There are 98 people who may have died from Covid-19 at the Isabella Center in New York City, according to a stateme… https://t.co/dYMBGOCfOQ",1256632304635699201,CNN
732,2020-05-02 17:00:06,"On World Press Freedom Day, journalists are facing an onslaught of repression in the form of new laws and intimidat… https://t.co/KtqTbqm3bx",1256629548508237825,CNN
733,2020-05-02 16:53:04,"Actor Sam Lloyd, who appeared on several television shows and portrayed lawyer Ted Buckland on the comedy, ""Scrubs,… https://t.co/SBkWMcQuwz",1256627778449027076,CNN
734,2020-05-02 16:44:05,"Health and Human Services Secretary Alex Azar announced that 1,000 coronavirus tests will be available as US senato… https://t.co/1IjxVBBPLm",1256625519749206022,CNN
735,2020-05-02 16:33:05,"Spaniards have finally been able to enjoy a walk, run or bike ride outdoors after seven weeks in confinement under… https://t.co/zDdObsLPuN",1256622749797187590,CNN
736,2020-05-02 16:22:45,New Jersey nurse Christina Pascarelli tears up after seeing a video message from a son whose mother she comforted a… https://t.co/4rsVEGFXuj,1256620149865676803,CNN
737,2020-05-02 16:22:05,Laurent Duvernay-Tardif — the first medical doctor to play in the NFL — was playing in the biggest game of his life… https://t.co/ewr2DHthq2,1256619982886252545,CNN
738,2020-05-02 16:12:03,"A 5.5-magnitude earthquake was recorded off the waters of southern Puerto Rico early Saturday, rattling the city of… https://t.co/J7paie60gn",1256617459819438081,CNN
739,2020-05-02 16:00:08,"Meet gargantuan hail. It's hail that's 6 inches across and larger, according to researchers who proposed the name https://t.co/QU3G6JpQcM",1256614458283233281,CNN
740,2020-05-02 15:44:04,"Scientists have created glow-in-the-dark plants that produce their own luminescence, glowing brighter than previous… https://t.co/ZWrX494AKw",1256610416521814017,CNN
741,2020-05-02 15:31:06,"Berkshire Hathaway, the massive conglomerate run by billionaire Warren Buffett, posted a nearly $50 billion net los… https://t.co/YKJtU5eC3a",1256607152384495616,CNN
742,2020-05-02 15:14:06,UK Prime Minister Boris Johnson and his fiancée Carrie Symonds have given their newborn son a middle name in honor… https://t.co/CFaDobSSil,1256602875956023296,CNN
743,2020-05-02 15:00:06,. @JakeTapper investigates what really happened in the U.S. fight against Covid-19. Discover what he learned. Watch… https://t.co/5efDcEwbKS,1256599349301325824,CNN
744,2020-05-02 14:46:03,"The Pentagon has officially released three short videos showing ""unidentified aerial phenomena"" that had previously… https://t.co/KrFQE0RCIF",1256595814228557824,CNN
745,2020-05-02 14:46:01,What we know about Tara Reade's allegation against Joe Biden https://t.co/NhZ209Mzvy,1256595806062366720,CNN
746,2020-05-02 14:31:06,"Is it still safe to go outside for a walk, run or jog? CNN's @drsanjaygupta provides tips for taking proper precaut… https://t.co/f6pS5SZTpy",1256592052923568128,CNN
747,2020-05-02 14:16:06,"A 1,000-year-old water mill in southwest England, which previously witnessed global pandemics such as the plague in… https://t.co/8zxmcLVqMr",1256588278956011522,CNN
748,2020-05-02 14:01:08,"What day is it, again?

Our internal clocks are shot. Tuesdays are Thursdays are Wednesdays are Sundays. There are… https://t.co/k9ou0DLn2J",1256584512550641666,CNN
749,2020-05-02 13:46:02,Celia Yap-Banago dedicated much of her life to her patients. But she died of coronavirus shortly before her 40th an… https://t.co/y8eoWmza3Q,1256580712368615424,CNN
750,2020-05-02 13:40:13,Epidemiologist Dr. John Ioannidis says his research shows that the coronavirus is “common” and that there's likely… https://t.co/Fqfli5YxwI,1256579248342564865,CNN
751,2020-05-02 13:32:08,"As some big cities were already seeing their populations dip, experts say the coronavirus pandemic could change who… https://t.co/mMuW2ULTcy",1256577212016472064,CNN
752,2020-05-02 13:16:02,Another wave of coronavirus will likely hit the US in the fall. Here's why and what we can do to stop it.… https://t.co/YM4M6Li7ai,1256573163913256960,CNN
753,2020-05-02 13:14:12,"“We can't work any harder to contain Covid-19, but can we work smarter?”

Here’s what that might look like, CNN’s… https://t.co/fWnWhfL2JX",1256572702674030592,CNN
754,2020-05-02 13:02:04,Owners of more than 120 of Georgia's most popular restaurants announced this week they won't be reopening their doo… https://t.co/Odv7kqoWOT,1256569646037286912,CNN
755,2020-05-02 12:44:05,"Actor Sam Lloyd, who appeared on several television shows and portrayed lawyer Ted Buckland on ""Scrubs,"" has died.… https://t.co/v8zXCi7PvH",1256565123654864896,CNN
756,2020-05-02 12:31:06,"For the first time in weeks, residents in some states across the country will be able to return to weekend routines… https://t.co/iadtIwtmzD",1256561852273897472,CNN
757,2020-05-02 12:16:03,A dog that saved her family's life by alerting them to a deadly tornado before it destroyed their Tennessee home ha… https://t.co/4aqU9UaKfb,1256558067971502081,CNN
758,2020-05-02 12:01:07,"""He's been so successful, it gives him an opportunity to do whatever the hell he wants or not to do things he doesn… https://t.co/cCbpD09s1C",1256554307454930944,CNN
759,2020-05-02 11:46:05,"The couple, who had been together for 73 years, had beds next to each other and got to say ""I love you"" to each oth… https://t.co/OyQ8GieHL3",1256550526134689792,CNN
760,2020-05-02 11:31:06,A photographer captured video of dolphins glowing as they glide through bioluminescent ocean water at night… https://t.co/BzaB4ehd7Z,1256546752758460418,CNN
761,2020-05-02 11:16:03,"The governor of Kentucky apologized for saying someone named Tupac Shakur, who had applied for unemployment in the… https://t.co/PTwJwZvR5c",1256542966669348866,CNN
762,2020-05-02 11:14:38,"The UK royal family has released new photos of Princess Charlotte, the daughter of the Duke and Duchess of Cambridg… https://t.co/P24vn9RD9m",1256542609419493377,CNN
763,2020-05-02 11:01:04,"Every morning, this pastor counts out hundreds of white flags to be planted on the front lawn of his Connecticut ch… https://t.co/bvQG5P6wOn",1256539196505890816,CNN
764,2020-05-02 10:46:03,"Future pandemics are likely to be more frequent, deadly, and will spread more rapidly, unless we stop the widesprea… https://t.co/r19ZL0lLBJ",1256535417417072641,CNN
765,2020-05-02 10:31:06,"With masks becoming a commonplace tool to stop the spread of the novel coronavirus, some iPhone owners are finding… https://t.co/1eSclBAbkK",1256531655919050752,CNN
766,2020-05-02 10:16:05,"With much of the world's human population stuck at home during the coronavirus pandemic, one Japanese aquarium is e… https://t.co/KYvhKdDZtO",1256527875433529344,CNN
767,2020-05-02 10:01:07,"A pop-up restaurant in Sweden will serve solo diners only. The promise and premise is no interaction with others, a… https://t.co/fYm7MjfX8f",1256524109065969664,CNN
768,2020-05-02 09:46:10,The US Department of Defense has confirmed that three UFO videos made public over the past several years do indeed… https://t.co/Mhwod3ZwkR,1256520347807027201,CNN
769,2020-05-02 09:31:06,This Texas principal spent 80 hours driving 800 miles over 12 days to visit more than 600 of his senior students https://t.co/AUBzAZfZ4p,1256516555212492802,CNN
770,2020-05-02 09:16:05,"While people in India are in lockdown, tens of thousands of flamingos are making the most of the peace and quiet… https://t.co/XlWersfsd3",1256512777394565121,CNN
772,2020-05-02 09:01:07,Ohio Republican Gov. Mike DeWine is blazing a path on how to lead — and listen — in dealing with a challenge the li… https://t.co/u3dgS901Dl,1256509011022798848,CNN
773,2020-05-02 08:46:05,Wuhan has been named the no.1 destination Chinese citizens want to visit after the coronavirus crisis is over. https://t.co/i0gofHpqRF,1256505226963701762,CNN
774,2020-05-02 08:31:04,Republican Sen. Mitt Romney of Utah has proposed a temporary pay raise for essential workers who are working during… https://t.co/6DCHXP4hzk,1256501449640591360,CNN
775,2020-05-02 08:16:01,"Assault-style weapons are banned in Canada effective immediately, Prime Minister Justin Trudeau said Friday. The mo… https://t.co/mv0jPY7FBT",1256497660137222145,CNN
776,2020-05-02 08:01:07,Democratic Michigan Gov. Gretchen Whitmer signed a new executive order on Friday that will allow some types of work… https://t.co/U3k729D462,1256493910840532992,CNN
777,2020-05-02 07:46:03,The novel coronavirus is likely to keep spreading for at least another 18 months to two years — until 60% to 70% of… https://t.co/n5Tsa8AYl9,1256490120947142656,CNN
778,2020-05-02 07:31:06,"The New York City Police Department will have more than 1,000 police officers on foot, bikes and in vehicles to enf… https://t.co/XzT57bSa5v",1256486357586845696,CNN
779,2020-05-02 07:16:06,"While Elon Musk certainly has a history of surviving ill-advised statements, his recent comments against coronaviru… https://t.co/UZL6TI69p9",1256482582205804545,CNN
780,2020-05-02 07:01:03,"The coronavirus pandemic is nowhere near over — but in some parts of the world, governments are slowly opening up f… https://t.co/L1ITI4S3iH",1256478796141690885,CNN
781,2020-05-02 06:46:05,"Trump is repeating his disastrous strategy from the early weeks of the US outbreak, when he acted as if coronavirus… https://t.co/ty0XTnx0lX",1256475026708144128,CNN
782,2020-05-02 06:31:08,"Vladimir Zelenko, a doctor who has pushed hydroxychloroquine usage for coronavirus to the White House and on Fox Ne… https://t.co/pFLs1Lnb2v",1256471265315033089,CNN
783,2020-05-02 06:16:05,A replenishment in the heavily criticized Paycheck Protection Program resulted in a firehose of small business lend… https://t.co/lKCVBywvRg,1256467477065863169,CNN
784,2020-05-02 06:03:00,"""I was really lucky to be alive.""

Coronavirus survivor Darrin Godin, who spent 9 days in a coma, shares his harrow… https://t.co/Jws0Lj5g2M",1256464184553938946,CNN
785,2020-05-02 06:01:05,Most states are taking steps to ease social distancing restrictions and the federal government has approved an expe… https://t.co/3WxhwOf9Ky,1256463704968900608,CNN
786,2020-05-02 05:46:04,A California couple was arrested at a Hawaii hotel on Thursday for allegedly violating the island state's mandatory… https://t.co/jTOukbI5Pr,1256459922188963841,CNN
787,2020-05-02 05:41:00,"New Mexico Gov. Michelle Lujan Grisham says ""it was not a hard decision"" to declare a state of emergency for the ci… https://t.co/wmbm0a0Sg8",1256458647900733440,CNN
788,2020-05-02 05:31:03,"Twenty years on, the ILOVEYOU virus remains one of the farthest reaching ever. The fight to contain the malware and… https://t.co/mJAkol22q6",1256456147118293003,CNN
789,2020-05-02 05:21:00,"""I'm seeing the numbers climb every day in Georgia. And as much as I want to go back into my salon and open my door… https://t.co/3zQdg5OQP9",1256453614844837894,CNN
790,2020-05-02 05:16:04,"As the IRS continues to send out stimulus payments, some who have used the agency's Get My Payment tool are frustra… https://t.co/ZeDWtytKlq",1256452372576043008,CNN
791,2020-05-02 04:51:07,"Here's a look at reasons why coronavirus is more dangerous than the flu — and why extra precautions are needed.

•… https://t.co/SuQITlDbSO",1256446094533369856,CNN
792,2020-05-02 04:46:04,A New York man has been accused of stealing nine coronavirus stimulus checks https://t.co/L76ZXLYOAq,1256444822732320770,CNN
793,2020-05-02 04:31:00,"""It's the art of statecraft to be able to cooperate and compete with a country, and that is where we are with China… https://t.co/LprlyWIgEF",1256441031916236800,CNN
794,2020-05-02 04:15:00,"""Until 60% to 70% of the US population has been infected and hopefully has immunity or we have a vaccine that accom… https://t.co/ZPW5kQeHXV",1256437005338083328,CNN
795,2020-05-02 04:11:05,This Florida lawyer is dressing up as the Grim Reaper and haunting beaches to protest their reopening https://t.co/pqaZHNSrJF,1256436020519763969,CNN
796,2020-05-02 04:08:02,The Idaho mother whose two children have been missing since September was denied a second reduction of her bail on… https://t.co/5R8Y38R7Ui,1256435254765682689,CNN
797,2020-05-02 04:01:00,Texas restaurant owner Mike Nguyen is battling cancer and recently lost his grandmother to Covid-19. Despite the fi… https://t.co/T1TQ5ida0n,1256433482340933632,CNN
798,2020-05-02 03:50:57,Fact check: New White House press secretary Kayleigh McEnany makes false claims in her first briefing https://t.co/4V6p0giLIo,1256430954677260288,CNN
799,2020-05-02 03:45:00,"John Barry is the co-author of a study suggesting the Covid-19 pandemic will last up to two more years.

""What we'v… https://t.co/5Lyt5SG0BL",1256429455700103168,CNN
800,2020-05-02 03:43:03,Nineteen minors ranging in age from 9 to 16 are suspected of stealing vehicles worth more than $1 million from auto… https://t.co/s4BaBNVH0R,1256428966069571584,CNN
801,2020-05-02 03:39:04,"Twenty years on, the first truly global computer virus remains one of the farthest reaching ever. Tens of millions… https://t.co/BICBF2Ov0x",1256427962519490560,CNN
802,2020-05-02 03:31:00,"""Had we had the testing when we needed it... This nation got months of warning from what was going on in China, we… https://t.co/X9n9fhHd1x",1256425932530712577,CNN
803,2020-05-02 03:18:06,Arkansas abortion providers and the ACLU are once again suing state officials for restricting abortion access durin… https://t.co/dQ7md7Uusy,1256422688467439616,CNN
804,2020-05-02 03:17:05,"The NBA has sent a memo to its 30 teams asking them to not test every player and staff member for coronavirus, a so… https://t.co/SRFpuhv3M8",1256422430253428739,CNN
805,2020-05-02 03:15:00,"Ohio Gov. Mike DeWine says ""we're always hopeful,"" reacting to the FDA's authorization of the emergency use of the… https://t.co/Gpv3QtydEU",1256421906028228610,CNN
806,2020-05-02 03:06:02,SpaceX's chief operating officer asked people to stay home to watch footage of the company's first-ever crewed miss… https://t.co/YffJ40rLKY,1256419650604281856,CNN
807,2020-05-02 03:03:31,"A man has been charged with arson for allegedly starting a fire that destroyed a mosque in Cape Girardeau, Missouri… https://t.co/hGdWiwW5mD",1256419015368617984,CNN
808,2020-05-02 03:01:00,"NYC Mayor Bill de Blasio criticizes the Brooklyn funeral home that stored bodies in unrefrigerated trucks. 

""There… https://t.co/l42hfhqNK5",1256418383030972417,CNN
809,2020-05-02 02:49:02,"A federal judge has dismissed the claims for equal pay by the US women's national soccer team, according to a court… https://t.co/cCPc4OddeE",1256415374364610560,CNN
810,2020-05-02 02:48:05,Two weeks after former Trump attorney Michael Cohen was moved into isolation for a 14-day quarantine in anticipatio… https://t.co/PX3WrNXjL1,1256415133041078280,CNN
811,2020-05-02 02:45:58,"A large crowd gathered in Huntington Beach, California, to protest the governor's order to close all beaches in Ora… https://t.co/zGxr8OALTr",1256414599173332992,CNN
812,2020-05-02 02:45:00,"NYT columnist Thomas Friedman: ""There's a time to fight with China. Now for me is not that time... We need to be wo… https://t.co/TbcoOitnNp",1256414356251656192,CNN
813,2020-05-02 02:32:38,Some malls and retailers are reopening their doors in states easing coronavirus restrictions. But fear of contracti… https://t.co/q9RhP16wso,1256411243985993728,CNN
814,2020-05-02 02:30:00,New York City Mayor Bill de Blasio says his city has a $7.4 billion budget gap and is calling on Congress for a sti… https://t.co/2G7RSXQwLb,1256410581621342209,CNN
