,Date,text,ID,Username
2163,2020-04-23 21:25:28,The Democratic-led Virginia General Assembly has passed two more gun control measures that complete the remaining l… https://t.co/zrquUwvevG,1253434843058196480,CNN
2164,2020-04-23 21:19:28,"Amoeba Music, the largest independent record store in the country, is turning to its legion of fans and loyal custo… https://t.co/UE8P2jvlbH",1253433329354866689,CNN
2165,2020-04-23 21:04:44,"CNN's @David_Culver is in Wuhan, China, as it reopens after months-long lockdown. Watch live on Facebook: https://t.co/jsXGo6Gb4F",1253429622521204746,CNN
2166,2020-04-23 20:55:29,"A preliminary study of 3,000 New Yorkers found that 13.9% of people statewide and 21% of people in New York City te… https://t.co/Tq7anngVUC",1253427296045641730,CNN
2167,2020-04-23 20:53:03,Ice waves are slowly crashing into homes as warm weather thaws Minnesota's lakes https://t.co/Kq0fx06rCN https://t.co/NOW6jXgKWO,1253426681936662530,CNN
2168,2020-04-23 20:49:07,While traditionally the vetting of — and jockeying by — potential vice presidential nominees happens largely out of… https://t.co/336F4AAEZH,1253425694459129856,CNN
2169,2020-04-23 20:30:26,Several recent reports have warned of a crushing decline in insect populations that could have a catastrophic effec… https://t.co/hMJjr16jjI,1253420991939657734,CNN
2170,2020-04-23 20:20:05,"Dayton, Ohio, furloughed over a quarter of its workforce. NYC won't provide summer jobs to 75,000 youth and will ke… https://t.co/lSox2unFao",1253418386622525441,CNN
2171,2020-04-23 20:10:03,House Democrats are calling for the Health and Human Services Inspector General to investigate the ousting of Dr. R… https://t.co/QBaIjpqNWk,1253415860670132226,CNN
2172,2020-04-23 20:00:04,Pollution levels are down dramatically in major cities around the world during the coronavirus pandemic. But will t… https://t.co/5eGyFyow7o,1253413351419346946,CNN
2173,2020-04-23 19:50:07,"An asteroid estimated to be 1.2 miles wide will fly by Earth next week, but it's not expected to collide with our p… https://t.co/sMiCq5NkRO",1253410846182498304,CNN
2174,2020-04-23 19:40:07,Ford engineers are working on electric Mustang SUVs in their own garages due to the coronavirus pandemic https://t.co/LPvkwS2cwN,1253408330162204672,CNN
2175,2020-04-23 19:30:07,"""The bottom line is that we REFUSE to risk even ONE Juggalo life by hosting a Gathering during these troubling time… https://t.co/9eKgQ5zCDa",1253405813454114816,CNN
2176,2020-04-23 19:20:05,"Students in Washington state won't have to worry about failing their classes, as they work to finish their schoolwo… https://t.co/MuCeJFqsLg",1253403287384178688,CNN
2177,2020-04-23 19:10:04,"Rep. Maxine Waters, a California Democrat and chairwoman of the influential House Financial Services Committee, say… https://t.co/bWPd0dGin7",1253400767425380352,CNN
2178,2020-04-23 19:00:08,Members of the coronavirus task force had to convince President Trump to change his view on Georgia's Republican go… https://t.co/Sn9eiNAIbN,1253398268526178306,CNN
2179,2020-04-23 18:54:10,"Former pro wrestler and yoga instructor Diamond Dallas Page says he will not be reopening his gym tomorrow, despite… https://t.co/QXSWbtDv2v",1253396764087906304,CNN
2180,2020-04-23 18:47:22,A Massachusetts emergency room nurse is helping patients affected by her hospital's no-visitor policy — by printing… https://t.co/kvlCqcgiK6,1253395053428514821,CNN
2181,2020-04-23 18:36:15,Dr. Rick Bright's decision to go public about his ouster is exposing months of turmoil inside one of the key divisi… https://t.co/3GjKjdDeUQ,1253392256385593344,CNN
2182,2020-04-23 18:20:05,The newly appointed Health and Human Services spokesperson promoted conspiracy theories and made racist and derogat… https://t.co/V1nx80CyLI,1253388186526658560,CNN
2183,2020-04-23 18:10:04,"There are at least 845,959 cases of coronavirus in the US, according to Johns Hopkins University's tally. At least… https://t.co/MsjUrt9KZm",1253385667486322690,CNN
2184,2020-04-23 18:00:04,"Farmers are rushing to adapt to the new normal, and the government is scrambling to help. https://t.co/wVdcB5heOF",1253383150090301454,CNN
2185,2020-04-23 17:51:04,"Michigan Gov. Gretchen Whitmer says she's assessing reopening parts of the state's economy, as the Democratic gover… https://t.co/jLDUeyvyu4",1253380885971374081,CNN
2186,2020-04-23 17:45:00,Video footage shows how a sledgehammer-wielding thief broke into a museum in the Netherlands and walked off with a… https://t.co/GRyYHfiYV3,1253379358674345984,CNN
2187,2020-04-23 17:30:08,Members of the coronavirus task force had to convince President Trump to change his view on Georgia's Republican go… https://t.co/Km4ItMqWhp,1253375617866874881,CNN
2188,2020-04-23 17:20:07,The Supreme Court on Thursday ruled that the Clean Water Act requires the federal government to regulate some groun… https://t.co/k9j5YrGUrg,1253373098830761986,CNN
2189,2020-04-23 17:10:05,A new study has found humans native to high-altitude areas may have a lower risk for chronic diseases such as hyper… https://t.co/UB9tn7p9eE,1253370570512744453,CNN
2190,2020-04-23 16:59:03,"“I think sports is walking this very fine line. It’s kind of a tightrope.” As the NFL Draft goes virtual,… https://t.co/eeqPfwRK1z",1253367796374872067,CNN
2191,2020-04-23 16:50:06,"Rural Americans have some advantages in avoiding Covid-19, but may also face problems of their own. Infection curve… https://t.co/NwJMnQe4Aq",1253365542955728896,CNN
2192,2020-04-23 16:47:20,"CNN readers from around the world have asked more than 90,000 questions about coronavirus. Many of the answers can… https://t.co/dGS2QMVx5M",1253364847288385536,CNN
2193,2020-04-23 16:45:06,A scuba diving group is turning plastic water bottles that once polluted the oceans into face masks for people to p… https://t.co/maFXzZP09Y,1253364285755084800,CNN
2194,2020-04-23 16:44:49,"Three abandoned infants were found in this Orlando apartment complex in 2016, 2017 and 2019. It wasn't until police… https://t.co/eRfaurlaBp",1253364214099513344,CNN
2195,2020-04-23 16:10:04,"CNN's @DrSanjayGupta is here to answer your questions about the coronavirus pandemic, specifically the plans for re… https://t.co/fFSwXFPNzQ",1253355468539527171,CNN
2196,2020-04-23 16:05:49,A 100-year-old World War II veteran who died from Covid-19 last week lost his twin brother to the 1918 influenza pa… https://t.co/SuhBuvxEOC,1253354398316716035,CNN
2197,2020-04-23 15:54:50,"Sales of newly built single-family homes plummeted 15.4% in March, totaling just 627,000 last month, according to d… https://t.co/FgBfxlGOLK",1253351636308840449,CNN
2198,2020-04-23 15:50:06,New research suggests that some birds evolved over time to have smaller bodies and maintain the large brains of the… https://t.co/RQLylppMlf,1253350441926168580,CNN
2199,2020-04-23 15:40:53,A new Trump campaign app uses gamification to drive voter outreach and valuable data collection. It's the latest ef… https://t.co/g0Ue8NFRkF,1253348124699090944,CNN
2200,2020-04-23 15:30:04,"At least 320 people in New York City died from coronavirus yesterday, Mayor Bill de Blasio said during a press conf… https://t.co/7SduCLZRqa",1253345403979825155,CNN
2201,2020-04-23 15:20:08,"Sen. Elizabeth Warren announced that her oldest brother, Don Reed, died from coronavirus on Tuesday. https://t.co/YntmqSzy0L",1253342901691731969,CNN
2202,2020-04-23 15:10:04,Gap is rapidly burning through cash as its stores remain shut during the coronavirus pandemic. The clothing company… https://t.co/CI6vHDDq7L,1253340368336117762,CNN
2203,2020-04-23 15:00:37,What do you want to ask the experts about coronavirus? Tweet your questions and we will feature some during a… https://t.co/rSjHEVn2e2,1253337990379851776,CNN
2204,2020-04-23 15:00:08,"Elmo, meet Dr. Sanjay Gupta. CNN and @SesameStreet are teaming up for The ABC’s of Covid-19: A #CNNSesameStreet Tow… https://t.co/SqUrb0QszY",1253337868287700998,CNN
2205,2020-04-23 14:52:11,"Meghan McCain, daughter of former Republican Sen. John McCain, said it shouldn't take a ""rocket scientist"" to figur… https://t.co/8EwK7mADO0",1253335868233809920,CNN
2206,2020-04-23 14:31:52,Coffee doesn't just wake you up in the morning. It may even lengthen your life -- but only if you prepare it with a… https://t.co/Nhv6OjQ2Wz,1253330755549147136,CNN
2207,2020-04-23 14:16:57,"“This is more than missing.” 

Health care workers around the world are separating from their families in an effort… https://t.co/3PShNyKfz7",1253327000170717186,CNN
2208,2020-04-23 13:50:04,"Ten Covid-19 unit nurses in Santa Monica, California, are heading back to work after being placed on paid administr… https://t.co/jNfgbYaJI6",1253320235878215681,CNN
2209,2020-04-23 13:41:01,"Crematoriums in hard-hit areas of New York have a backlog of nearly a month. Now, volunteers are coming to their ai… https://t.co/S6bgPFoiE5",1253317957142417409,CNN
2210,2020-04-23 13:25:46,"As Americans face a new normal, Trump returns to the old playbook | Analysis by @GloriaBorger… https://t.co/BRXpUabpra",1253314119274463233,CNN
2211,2020-04-23 13:16:04,"A seemingly healthy 57-year-old Bay Area woman who ""suddenly died"" in early February has now become the first known… https://t.co/2ws8Yg95kv",1253311678139244546,CNN
2212,2020-04-23 13:00:19,". @AliciaKeys will join CNN for the world premiere of her new song “Good Job,” dedicated to the everyday heroes of… https://t.co/w35iFNID79",1253307717705400320,CNN
2213,2020-04-23 12:56:18,Gyms made it in Phase One of President Trump's coronavirus reopening plan. Here's an inside look at the last-minute… https://t.co/954zVCap62,1253306704000954369,CNN
2214,2020-04-23 12:30:06,At least 10% of the country’s pork production is offline right now. That number could rise this week with additiona… https://t.co/xGtqMdRpiB,1253300110857043968,CNN
2215,2020-04-23 12:20:10,"Older adults with Covid-19, the illness caused by the coronavirus, have several ""atypical"" symptoms, complicating e… https://t.co/ZHDTDfmDuD",1253297612771471362,CNN
2216,2020-04-23 12:08:28,The US Census Bureau estimates that about 11.5 million Americans have some degree of hearing loss. Many in the Deaf… https://t.co/vxi6QmDl7X,1253294667883581441,CNN
2217,2020-04-23 11:45:08,Abortions in Texas can resume following a legal battle over Republican Gov. Greg Abbott's order that was interprete… https://t.co/NrBZtwxS19,1253288797401473024,CNN
2218,2020-04-23 11:33:41,"Seven more big cats have coronavirus at the Bronx Zoo, in addition to a tiger that tested positive earlier this mon… https://t.co/UUz2NcPzFE",1253285916023623681,CNN
2219,2020-04-23 11:20:06,"""The cool thing about these guys is that they have really, really, really long, um, trunks, And that's, that's cool… https://t.co/WKCUKK6WRx",1253282495660990469,CNN
2220,2020-04-23 11:13:51,The deluge of Americans filing jobless claims isn't over. Another 4.2 million claims for first-time unemployment be… https://t.co/R5zbwRoJ28,1253280923442982915,CNN
2221,2020-04-23 11:00:06,"For years, northern India has battled air pollution with levels hitting the hazardous mark during the winter season… https://t.co/RQ8X77T4mi",1253277462559182848,CNN
2222,2020-04-23 10:41:01,"Shocking photos show seven bodies, in the open back of a pick-up truck in Philadelphia, which were transported from… https://t.co/E9ea6FmESJ",1253272661859467264,CNN
2223,2020-04-23 10:34:54,At least six people were killed Wednesday and more than a dozen injured as severe storms ripped through Southern Ok… https://t.co/JxCKkr6Rdu,1253271121668997120,CNN
2224,2020-04-23 10:13:07,Prince Louis' 2nd birthday got a little messy. The Duke and Duchess of Cambridge released images of their youngest… https://t.co/98F0EmhT8S,1253265640170950656,CNN
2225,2020-04-23 10:00:17,". @AliciaKeys will join CNN for the world premiere of her new song “Good Job,” dedicated to the everyday heroes of… https://t.co/dKdjmZnZeH",1253262408799465479,CNN
2226,2020-04-23 08:56:07,Coffee doesn't just wake you up in the morning. It may even lengthen your life -- but only if you prepare it with a… https://t.co/fsv5yuFRIg,1253246260879994881,CNN
2227,2020-04-23 08:37:04,"Seven more big cats have coronavirus at the Bronx Zoo, in addition to a tiger that tested positive earlier this mon… https://t.co/DOGjqEKdyK",1253241468904525826,CNN
2228,2020-04-23 08:24:04,Alarming new signs are emerging that the Trump administration is shunting science aside in the battle against coron… https://t.co/PYbjDK2Msy,1253238196554661888,CNN
2229,2020-04-23 08:09:43,"""Saudi Arabia attempting to use the glamor and prestige of Premier League football as a PR tool to distract from th… https://t.co/oCyE9VUGQ3",1253234583203721216,CNN
2230,2020-04-23 07:56:03,"A seemingly healthy 57-year-old Bay Area woman who ""suddenly died"" in early February has now become the first known… https://t.co/Qtzm6cHhnk",1253231146252582912,CNN
2231,2020-04-23 07:51:04,How coronavirus has changed Ramadan for Muslims this year https://t.co/MTTev92AHt https://t.co/KczeeFCKWh,1253229891933351936,CNN
2232,2020-04-23 07:07:13,"Starting Thursday, coronavirus testing will be available to all critical workers in Los Angeles that are on the fro… https://t.co/RjNKxpXU1g",1253218854869839876,CNN
2233,2020-04-23 06:58:03,Two African American women who allege that management at a Pennsylvania golf course mistreated them when they calle… https://t.co/mQtHN9QygD,1253216549114195971,CNN
2234,2020-04-23 06:47:05,"Three abandoned infants were found in this Orlando apartment complex in 2016, 2017 and 2019. It wasn't until police… https://t.co/pauY8bhrjO",1253213790814056455,CNN
2235,2020-04-23 06:41:06,"Some states may be planning to reopen businesses and communities despite the continuing coronavirus pandemic, but a… https://t.co/oQ9HyYY8fG",1253212282403917827,CNN
2236,2020-04-23 06:37:06,"Seven more big cats have coronavirus at the Bronx Zoo, in addition to a tiger that tested positive earlier this mon… https://t.co/dub2DtWQSU",1253211274667753472,CNN
2237,2020-04-23 06:20:09,Coffee doesn't just wake you up in the morning. It may even lengthen your life -- but only if you prepare it with a… https://t.co/by3rZnWD0j,1253207012596473856,CNN
2238,2020-04-23 06:14:07,"Six weeks into a near-total shutdown of the US, some governors are preparing to resume life as usual. But some plac… https://t.co/UZTUO7ydR2",1253205490760396802,CNN
2239,2020-04-23 06:11:07,"Two cats in New York have been infected with the novel coronavirus, making them the first pets in the US known to b… https://t.co/ZsnEHrDgcf",1253204739287912450,CNN
2240,2020-04-23 06:10:02,At least four people were killed on Wednesday after severe storms ripped through Southern Oklahoma and Texas. https://t.co/uiufavsAbM,1253204466578448384,CNN
2241,2020-04-23 06:07:04,"Tiger Woods, Peyton Manning, Phil Mickelson and Tom Brady will all be taking the golf course for a two-on-two live… https://t.co/qz5o3AlGxI",1253203720025911297,CNN
2242,2020-04-23 05:52:06,A scuba diving group is turning plastic water bottles that once polluted the oceans into face masks for people to p… https://t.co/M9JwqTnyBx,1253199953142439937,CNN
2243,2020-04-23 05:46:08,"Crematoriums in hard-hit areas of New York have a backlog of nearly a month. Now, volunteers are coming to their ai… https://t.co/0Re6mkVCoP",1253198448276488192,CNN
2244,2020-04-23 05:35:02,A top administration official working on a coronavirus vaccine claimed he was ousted after resisting efforts to pus… https://t.co/QuEy8kurri,1253195655549456384,CNN
2245,2020-04-23 05:34:08,"President Trump made yet another false claim about coronavirus testing, wrongly saying that the US is conducting mo… https://t.co/RsSkuw1Ib8",1253195429036130310,CNN
2246,2020-04-23 05:26:04,"Loss of taste or smell does indeed seem to be a symptom of Covid-19 infection, researchers say. A survey of more th… https://t.co/jbeJSaLbE5",1253193401228578817,CNN
2247,2020-04-23 05:24:01,A 100-year-old World War II veteran who died from Covid-19 last week lost his twin brother to the 1918 influenza pa… https://t.co/6T0OAipo4c,1253192885094305793,CNN
2248,2020-04-23 05:20:02,House Speaker Nancy Pelosi says Democratic Rep. Donna Shalala of Florida will remain on a newly created congression… https://t.co/7oBMDoDFpW,1253191883708338176,CNN
2249,2020-04-23 05:18:06,"The New York Stock Exchange might reopen in phases after May 15, according to two sources who were on a conference… https://t.co/Lv6rpbGtpu",1253191394207969281,CNN
2250,2020-04-23 05:10:04,"Torbjørn ""Thor"" Pedersen is on a mission to visit every country in the world in a single journey, without taking an… https://t.co/NfBjQNvoZl",1253189372800897032,CNN
2251,2020-04-23 05:10:03,The coronavirus has turned China's relations with the US into a potentially defining issue in the clash between Joe… https://t.co/rlVJ5GY962,1253189371290890240,CNN
2252,2020-04-23 05:01:00,"""Stop talking about my constituents as though they're guinea pigs in some grand experiment."" Rep. Dina Titus of Nev… https://t.co/PsX4rAjw7B",1253187090969497602,CNN
2253,2020-04-23 04:55:02,"Starting Thursday, coronavirus testing will be available to all critical workers in Los Angeles that are on the fro… https://t.co/RpURyREkf2",1253185591824592901,CNN
2254,2020-04-23 04:55:02,Several koalas who were injured in bushfires in Australia in 2019 have been re-released into the wild https://t.co/XYWAwsReSv,1253185591790968834,CNN
2255,2020-04-23 04:53:08,"Rural Americans have some advantages in avoiding Covid-19, but may also face problems of their own. Infection curve… https://t.co/nywgeCMzAe",1253185112176562176,CNN
2256,2020-04-23 04:51:00,"""I think this is too early. I think it's too soon.""

Roswell, Georgia, Mayor Lori Henry says she feels her state is… https://t.co/mmxaJIyns7",1253184574328205313,CNN
2257,2020-04-23 04:45:04,"Coffee could be good for you, as long as you brew it correctly. It may even lengthen your life — if you prepare it… https://t.co/WhTTsyFi63",1253183083718807552,CNN
2258,2020-04-23 04:42:06,The US state of Indiana is working to go back and identify every death they think may have been associated with Cov… https://t.co/ePnNX1kCJC,1253182335887032321,CNN
2259,2020-04-23 04:25:45,"At least 842,376 coronavirus cases, including 46,769 deaths, have been recorded in the United States, according to… https://t.co/yZS2EZOgGc",1253178220750548993,CNN
2260,2020-04-23 04:25:30,The Trump administration official who oversaw the production and purchase of vaccines before being abruptly dismiss… https://t.co/NfIeIeZe3P,1253178156502130693,CNN
2261,2020-04-23 04:14:48,"Mexico has topped 10,000 cases of coronavirus, Deputy Health Secretary Dr. Hugo López-Gatell said https://t.co/NIv6Nt6OIl",1253175463436050433,CNN
2262,2020-04-23 04:00:36,This scuba diving group is turning plastic water bottles that once polluted oceans into face masks for people to pr… https://t.co/qwpHtsMWPW,1253171893596753920,CNN
2263,2020-04-23 03:45:03,Eleven tribal organizations affected by coronavirus — including the hard-hit Navajo Nation — are suing the federal… https://t.co/6JAaIW7sM1,1253167977236758530,CNN
2264,2020-04-23 03:41:04,Senate Majority Leader Mitch McConnell took a hard line against more funding for state and local governments in the… https://t.co/PPcfdedxHZ,1253166974894575616,CNN
2265,2020-04-23 03:39:46,Former VP Joe Biden received endorsements from Washington Gov. Jay Inslee and former VP Al Gore on the 50th anniver… https://t.co/jMoUNrY9K0,1253166648716115971,CNN
2266,2020-04-23 03:37:05,"This week should have seen a White House state dinner that would have been the Trump administration's third. Still,… https://t.co/JyKigKnBCx",1253165975438065664,CNN
2267,2020-04-23 03:35:04,Skateboarders were temporarily deterred after 37 tons of sand was placed at a California skate park as part of soci… https://t.co/lHQOJrITnb,1253165465993728002,CNN
2269,2020-04-23 03:32:03,"To end the coronavirus pandemic, the US is either going to have to continue with extreme social distancing measures… https://t.co/LBMshJZ7iS",1253164707273457665,CNN
2270,2020-04-23 03:30:44,"""It's too late to continue business as usual at the plant.""

Waterloo, Iowa, Mayor Quentin Hart and Logansport, Ind… https://t.co/dePMrUrCKy",1253164375839395841,CNN
2271,2020-04-23 03:30:09,"A recent Dept. of Veterans Affairs memo warns current protective medical gear supply levels ""do not support providi… https://t.co/FGrbsevyFJ",1253164230632714240,CNN
2272,2020-04-23 03:27:51,"Former FDA Commissioner Margaret Hamburg says Dr. Rick Bright, the former director of a key federal vaccine agency,… https://t.co/C5FABMW0TO",1253163650963013632,CNN
2273,2020-04-23 03:25:05,Congress is about to give the Small Business Administration hundreds of billions more in funding for the emergency… https://t.co/juk5o7fAEt,1253162955639853056,CNN
2274,2020-04-23 03:19:03,"""The terms and conditions of our lives have changed beyond recognition in recent weeks. It's time the terms and con… https://t.co/cEnd5s2l6R",1253161436618113031,CNN
2275,2020-04-23 03:14:34,"Six weeks into a near-total shutdown of the US, some governors are preparing to resume life as usual. But some plac… https://t.co/dC2TlQPQoJ",1253160306391633922,CNN
2276,2020-04-23 03:11:06,Canadian police officials said they failed to issue a timely public alert about the gunman responsible for the Nova… https://t.co/8fVTNYblx7,1253159433737310208,CNN
2277,2020-04-23 03:07:06,"After more than a week of public pressure, Tyson announced Wednesday morning it will ""indefinitely suspend operatio… https://t.co/vsZJfC1Fb8",1253158429549629443,CNN
2278,2020-04-23 03:04:56,"In what's described as the largest study of its kind, New York researchers have submitted to the state health depar… https://t.co/5WuWs4nWUD",1253157883677679616,CNN
2279,2020-04-23 03:02:45,"Biden leads Trump in head-to-head matchups in Michigan and Pennsylvania, new Fox polls show. Almost half of registe… https://t.co/EhTalIbf2H",1253157333401731072,CNN
2280,2020-04-23 02:59:30,"At least two people were killed after severe storms ripped through southern Oklahoma, Marshall County emergency off… https://t.co/9hQd96i9lE",1253156515504152582,CNN
2281,2020-04-23 02:56:18,Harvard University said it would not accept the federal funds allocated to it under the CARES Act Higher Education… https://t.co/LJCcm4vX4M,1253155709954506754,CNN
2282,2020-04-23 02:47:10,Demonstrators took to the streets in Bogota to protest against a lack of support during harsh measures taken by the… https://t.co/iXgPy3uDfY,1253153411371020290,CNN
2283,2020-04-23 02:39:24,"Up to 300,000 people in the UK will take part in a major long-term study to track the spread of coronavirus in the… https://t.co/7Ui5veun1r",1253151456259198976,CNN
2284,2020-04-23 02:29:23,"UPS' most frantic time of year is typically around the winter holidays, but as people shop online during the corona… https://t.co/81UZB3MNR2",1253148934664531970,CNN
2285,2020-04-23 02:23:24,"""Real death is real, right? Economic death is not death. ... The economy, we can figure out, right?""

@NYGovCuomo r… https://t.co/woc7L3N7hK",1253147430398259201,CNN
2286,2020-04-23 02:19:29,"As major meat processing plants are closing because workers have become infected by coronavirus, there's growing co… https://t.co/Rl0rjHIlpD",1253146444845838337,CNN
2287,2020-04-23 02:19:15,"About 150,000 Covid-19 tests will arrive in Colorado from South Korea by the end of the week, with a further 150,00… https://t.co/DLK7UjZHlG",1253146385605709826,CNN
2288,2020-04-23 02:18:26,"""The President wants to be optimistic. ... He wants to see those markets come back,"" says @NYGovCuomo on why Trump… https://t.co/eDkr8ZG4tM",1253146181535797248,CNN
2289,2020-04-23 02:09:14,"Six weeks into a near-total shutdown of the US, some governors are preparing to resume life as usual. But some plac… https://t.co/qWDo4zE3y4",1253143866787627008,CNN
2290,2020-04-23 01:53:04,The Justice Department probe into the origins of the Russia investigation is continuing to progress as the coronavi… https://t.co/i9EbM9PDXX,1253139795771080708,CNN
2291,2020-04-23 01:44:39,"The UK will have to rely on social distancing measures until there is a vaccine or a treatment for coronavirus, Eng… https://t.co/qLyWqQdWs3",1253137677597188098,CNN
2292,2020-04-23 01:40:09,Gov. Brian Kemp says Georgia will continue with business reopenings this Friday despite President Trump's comments… https://t.co/TYkVcBfsze,1253136546661793792,CNN
2293,2020-04-23 01:40:06,"Georgia's reopening plan is the most aggressive in the US, but other states are considering their options. A corona… https://t.co/4YiY7WrtcC",1253136534481616896,CNN
2294,2020-04-23 01:33:36,"""I'm very alarmed that you get a lot of political spin before and after scientists talk,"" former Secretary of Healt… https://t.co/ZZt1877JrP",1253134897490743297,CNN
2295,2020-04-23 01:27:54,President Trump signed his anticipated executive order barring some immigration to the United States on Wednesday e… https://t.co/FYPqIeuuze,1253133462485241856,CNN
2296,2020-04-23 01:25:15,"""I embrace the reminder that the stress of solitude is nothing compared to the risks faced by health care workers.… https://t.co/2jk4xYE5gR",1253132797709037570,CNN
2297,2020-04-23 01:18:14,"United Airlines, whose shares have plummeted in value by 68% in the last 9 weeks, is planning to raise $1 billion b… https://t.co/tTdfPbivvn",1253131029675737089,CNN
